{
  "$schema": "https://json-schema.org/draft/2020-12/schema",
  "$id": "urn:definitely-secure:contract:execution-provenance:1.0.0:record",
  "type": "object",
  "additionalProperties": false,
  "required": [
    "spec_version",
    "kind",
    "record",
    "identity"
  ],
  "properties": {
    "spec_version": {
      "const": "1.0.0"
    },
    "kind": {
      "const": "execution-provenance"
    },
    "record": {
      "type": "object",
      "additionalProperties": false,
      "required": [
        "execution_id",
        "prompt",
        "contexts",
        "redacted_context_count",
        "target",
        "identity",
        "parameters",
        "parameters_status",
        "stop_sequence_count",
        "timing",
        "status",
        "finish_reason",
        "validation",
        "structured_output",
        "policy"
      ],
      "properties": {
        "execution_id": {
          "type": "string"
        },
        "correlation_id": {
          "type": "string"
        },
        "prompt": {
          "type": "object",
          "additionalProperties": false,
          "required": [
            "id",
            "version",
            "spec_version"
          ],
          "properties": {
            "id": {
              "type": "string"
            },
            "version": {
              "type": "string"
            },
            "spec_version": {
              "type": "string"
            }
          }
        },
        "rendered": {
          "type": "object",
          "additionalProperties": false,
          "required": [
            "byte_size",
            "sha256"
          ],
          "properties": {
            "byte_size": {
              "type": "integer",
              "minimum": 0
            },
            "sha256": {
              "type": "string",
              "pattern": "^sha256:[0-9a-f]{64}$"
            }
          }
        },
        "contexts": {
          "type": "array",
          "items": {
            "type": "object",
            "additionalProperties": false,
            "required": [
              "slot",
              "classification"
            ],
            "properties": {
              "slot": {
                "type": "string"
              },
              "classification": {
                "type": "string"
              },
              "package": {
                "type": "object",
                "additionalProperties": false,
                "required": [
                  "id",
                  "version",
                  "instance_id",
                  "manifest_sha256"
                ],
                "properties": {
                  "id": {
                    "type": "string"
                  },
                  "version": {
                    "type": "string"
                  },
                  "instance_id": {
                    "type": "string"
                  },
                  "manifest_sha256": {
                    "type": "string"
                  }
                }
              },
              "sources": {
                "type": "array",
                "items": {
                  "type": "object",
                  "additionalProperties": false,
                  "required": [
                    "source_id",
                    "version",
                    "kind",
                    "classification"
                  ],
                  "properties": {
                    "source_id": {
                      "type": "string"
                    },
                    "version": {
                      "type": "string"
                    },
                    "kind": {
                      "type": "string"
                    },
                    "classification": {
                      "type": "string"
                    }
                  }
                }
              }
            }
          }
        },
        "redacted_context_count": {
          "type": "integer",
          "minimum": 0
        },
        "target": {
          "type": "object",
          "additionalProperties": false,
          "required": [
            "adapter_id",
            "provider_id",
            "model_id"
          ],
          "properties": {
            "adapter_id": {
              "type": "string"
            },
            "provider_id": {
              "type": "string"
            },
            "model_id": {
              "type": "string"
            }
          }
        },
        "identity": {
          "type": "object",
          "additionalProperties": false,
          "required": [
            "adapter_id",
            "adapter_version",
            "provider_id",
            "model_id"
          ],
          "properties": {
            "adapter_id": {
              "type": "string"
            },
            "adapter_version": {
              "type": "string"
            },
            "provider_id": {
              "type": "string"
            },
            "model_id": {
              "type": "string"
            },
            "model_revision": {
              "type": "string"
            }
          }
        },
        "parameters": {
          "type": "object",
          "additionalProperties": false,
          "required": [],
          "properties": {
            "max_output_tokens": {
              "type": "number"
            },
            "temperature": {
              "type": "number"
            },
            "top_p": {
              "type": "number"
            },
            "seed": {
              "type": "number"
            }
          }
        },
        "parameters_status": {
          "enum": [
            "resolved",
            "not-resolved"
          ]
        },
        "stop_sequence_count": {
          "type": "integer",
          "minimum": 0
        },
        "timing": {
          "type": "object",
          "additionalProperties": false,
          "required": [
            "started_at",
            "completed_at",
            "duration_ms"
          ],
          "properties": {
            "started_at": {
              "type": "string"
            },
            "completed_at": {
              "type": "string"
            },
            "duration_ms": {
              "type": "integer",
              "minimum": 0
            }
          }
        },
        "status": {
          "enum": [
            "succeeded",
            "failed",
            "cancelled",
            "timed-out"
          ]
        },
        "finish_reason": {
          "enum": [
            "stop",
            "length",
            "content-filter",
            "cancelled",
            "error",
            "unknown"
          ]
        },
        "usage": {
          "type": "object",
          "additionalProperties": false,
          "required": [
            "provider_reported"
          ],
          "properties": {
            "provider_reported": {
              "type": "boolean"
            },
            "input_tokens": {
              "type": "integer",
              "minimum": 0
            },
            "output_tokens": {
              "type": "integer",
              "minimum": 0
            },
            "total_tokens": {
              "type": "integer",
              "minimum": 0
            }
          }
        },
        "output": {
          "type": "object",
          "additionalProperties": false,
          "required": [
            "byte_size",
            "sha256"
          ],
          "properties": {
            "byte_size": {
              "type": "integer",
              "minimum": 0
            },
            "sha256": {
              "type": "string",
              "pattern": "^sha256:[0-9a-f]{64}$"
            }
          }
        },
        "validation": {
          "type": "object",
          "additionalProperties": false,
          "required": [
            "status",
            "errors",
            "warnings"
          ],
          "properties": {
            "status": {
              "enum": [
                "not-run",
                "passed",
                "failed"
              ]
            },
            "errors": {
              "type": "integer",
              "minimum": 0
            },
            "warnings": {
              "type": "integer",
              "minimum": 0
            }
          }
        },
        "structured_output": {
          "type": "object",
          "additionalProperties": false,
          "required": [
            "status"
          ],
          "properties": {
            "status": {
              "enum": [
                "not-run",
                "validated",
                "failed"
              ]
            },
            "processing_id": {
              "type": "string"
            }
          }
        },
        "policy": {
          "type": "object",
          "additionalProperties": false,
          "required": [
            "content_identities",
            "bodies"
          ],
          "properties": {
            "content_identities": {
              "enum": [
                "public-only",
                "omit"
              ]
            },
            "bodies": {
              "const": "omitted"
            }
          }
        }
      }
    },
    "identity": {
      "type": "object",
      "additionalProperties": false,
      "required": [
        "byte_size",
        "sha256"
      ],
      "properties": {
        "byte_size": {
          "type": "integer",
          "minimum": 0
        },
        "sha256": {
          "type": "string",
          "pattern": "^sha256:[0-9a-f]{64}$"
        }
      }
    }
  }
}
