{
  "spec_version": "1.0.0",
  "kind": "execution-provenance",
  "record": {
    "execution_id": "exec_provenance_example",
    "correlation_id": "build_example",
    "prompt": {
      "id": "prompt.example.describe-public-item",
      "version": "1.0.0",
      "spec_version": "1.0.0"
    },
    "contexts": [],
    "redacted_context_count": 0,
    "target": {
      "adapter_id": "studio.mock.text",
      "provider_id": "studio-mock",
      "model_id": "mock-text-v1"
    },
    "identity": {
      "adapter_id": "studio.mock.text",
      "adapter_version": "1.0.0",
      "provider_id": "studio-mock",
      "model_id": "mock-text-v1",
      "model_revision": "synthetic-1"
    },
    "parameters": {
      "max_output_tokens": 256,
      "temperature": 1,
      "top_p": 1
    },
    "parameters_status": "resolved",
    "stop_sequence_count": 0,
    "timing": {
      "started_at": "1970-01-01T00:00:00.000Z",
      "completed_at": "1970-01-01T00:00:00.000Z",
      "duration_ms": 0
    },
    "status": "succeeded",
    "finish_reason": "stop",
    "validation": {
      "status": "not-run",
      "errors": 0,
      "warnings": 0
    },
    "structured_output": {
      "status": "not-run"
    },
    "policy": {
      "content_identities": "public-only",
      "bodies": "omitted"
    },
    "usage": {
      "provider_reported": true,
      "input_tokens": 18,
      "output_tokens": 4,
      "total_tokens": 22
    },
    "rendered": {
      "byte_size": 872,
      "sha256": "sha256:a646b6b7f701371c838fbe061fa7438a0440a4b09516fc3d1c167bf041fb3705"
    },
    "output": {
      "byte_size": 24,
      "sha256": "sha256:ad56d367cf578d1295ce4a8b14d7ebb4357a1311f4fcd5e3d672a5d8f10f5d4a"
    }
  },
  "identity": {
    "byte_size": 1211,
    "sha256": "sha256:b951d0e1ebf50509bd9cd0cbb10f6dd184cf28db8c13f68e4648d647dc0c572f"
  }
}
